{
  "ave_id": "AVE-2025-0045",
  "name": "Memory Provenance Laundering",
  "aliases": [
    "Knowledge Washing",
    "Source Amnesia"
  ],
  "category": "memory",
  "severity": "high",
  "status": "proven",
  "summary": "Planted facts injected into agent memory are later cited as the agent's own knowledge with 53% citation rate. The agent cannot distinguish between genuine learned knowledge and adversarially planted memories.",
  "mechanism": "Attacker injects false facts into the agent's long-term memory store. On subsequent retrieval, the agent treats these memories identically to legitimate ones, citing them with high confidence. [Available in NAIL SDK]",
  "blast_radius": "Agent makes decisions based on adversary-controlled 'memories'. No audit trail to original injection.",
  "prerequisite": "Agent with persistent memory or RAG-based knowledge retrieval.",
  "environment": {
    "frameworks": [
      "LangGraph"
    ],
    "models_tested": [
      "[Available in NAIL SDK]"
    ],
    "multi_agent": false,
    "tools_required": false,
    "memory_required": true
  },
  "evidence": [
    {
      "experiment_id": "[Available in NAIL SDK]",
      "key_metric": "[Available in NAIL SDK]",
      "key_value": "[Available in NAIL SDK]",
      "data_file": "",
      "p_value": null,
      "sample_size": null,
      "cross_model": false
    }
  ],
  "defences": [],
  "date_discovered": "2026-03",
  "date_published": "",
  "cwe_mapping": "",
  "mitre_mapping": "",
  "references": [],
  "related_aves": [
    "AVE-2025-0001",
    "AVE-2025-0003"
  ],
  "avss_score": {
    "overall_score": 7.9,
    "severity_label": "high",
    "vector_string": "[Available in NAIL SDK]",
    "base_score": null,
    "temporal_score": null,
    "agentic_score": null,
    "vector": null
  },
  "poc": null,
  "timeline": null,
  "_meta": {
    "schema_version": "1.0.0",
    "generated_at": "2026-03-24T19:26:21Z",
    "generator": "NAIL Institute AVE Toolkit",
    "license": "CC-BY-SA-4.0",
    "access_tier": "public",
    "redacted_fields": [
      "avss_score",
      "defences",
      "evidence",
      "mechanism",
      "poc",
      "timeline"
    ],
    "full_access": "https://github.com/NAIL-INSTITUTE-FOR-AGENTIC-SECURITY/ave-database"
  },
  "contributor": "dleigh"
}