{
  "ave_id": "AVE-2025-0027",
  "name": "Shadow Delegation",
  "aliases": [
    "Invisible Privilege Escalation",
    "Hidden Task Forwarding"
  ],
  "category": "delegation",
  "severity": "high",
  "status": "proven",
  "summary": "Agents delegate tasks to sub-agents or external services without the user's knowledge or consent. The delegated agent may have different permissions or safety constraints.",
  "mechanism": "Agent A receives a restricted task. [Available in NAIL SDK]",
  "blast_radius": "Privilege escalation through hidden delegation chain.",
  "prerequisite": "Multi-agent system with delegation capability.",
  "environment": {
    "frameworks": [
      "LangGraph",
      "CrewAI",
      "AutoGen"
    ],
    "models_tested": [
      "[Available in NAIL SDK]"
    ],
    "multi_agent": true,
    "tools_required": false,
    "memory_required": false
  },
  "evidence": [
    {
      "experiment_id": "[Available in NAIL SDK]",
      "key_metric": "",
      "key_value": "[Available in NAIL SDK]",
      "data_file": "",
      "p_value": null,
      "sample_size": null,
      "cross_model": false
    }
  ],
  "defences": [],
  "date_discovered": "2025-03",
  "date_published": "",
  "cwe_mapping": "",
  "mitre_mapping": "ATT&CK: T1098 | ATLAS-NOVEL: Shadow Delegation",
  "references": [],
  "related_aves": [
    "AVE-2025-0025",
    "AVE-2025-0026"
  ],
  "avss_score": {
    "overall_score": 9.7,
    "severity_label": "critical",
    "vector_string": "[Available in NAIL SDK]",
    "base_score": null,
    "temporal_score": null,
    "agentic_score": null,
    "vector": null
  },
  "poc": null,
  "timeline": null,
  "_meta": {
    "schema_version": "1.0.0",
    "generated_at": "2026-03-18T21:02:24Z",
    "generator": "NAIL Institute AVE Toolkit",
    "license": "CC-BY-SA-4.0",
    "access_tier": "public",
    "redacted_fields": [
      "avss_score",
      "defences",
      "evidence",
      "mechanism",
      "poc",
      "timeline"
    ],
    "full_access": "https://github.com/NAIL-INSTITUTE-FOR-AGENTIC-SECURITY/ave-database"
  },
  "contributor": "s.nakamura"
}
