{
  "ave_id": "AVE-2025-0039",
  "name": "Cross-Agent Belief Propagation",
  "aliases": [
    "Epistemic Contagion",
    "Viral Hallucination"
  ],
  "category": "consensus",
  "severity": "high",
  "status": "proven",
  "summary": "False beliefs introduced into one agent propagate through multi-agent teams at 50-55% contagion rate. Agents treat peer outputs as trusted sources, amplifying hallucinations across the system.",
  "mechanism": "Agent A generates a hallucinated fact. Agent B reads A's output and incorporates it as grounded knowledge. Agent C cites B, laundering the provenance. [Available in NAIL SDK]",
  "blast_radius": "Entire team operates on false premises. Downstream decisions based on fabricated data. No single point of correction.",
  "prerequisite": "Multi-agent system with shared context or message passing.",
  "environment": {
    "frameworks": [
      "LangGraph"
    ],
    "models_tested": [
      "[Available in NAIL SDK]"
    ],
    "multi_agent": true,
    "tools_required": false,
    "memory_required": false
  },
  "evidence": [
    {
      "experiment_id": "[Available in NAIL SDK]",
      "key_metric": "[Available in NAIL SDK]",
      "key_value": "[Available in NAIL SDK]",
      "data_file": "",
      "p_value": null,
      "sample_size": null,
      "cross_model": false
    }
  ],
  "defences": [],
  "date_discovered": "2026-03",
  "date_published": "",
  "cwe_mapping": "",
  "mitre_mapping": "ATT&CK: T1080 | ATLAS-NOVEL: Cross-Agent Belief Propagation",
  "references": [],
  "related_aves": [
    "AVE-2025-0003",
    "AVE-2025-0015"
  ],
  "avss_score": {
    "overall_score": 7.8,
    "severity_label": "high",
    "vector_string": "[Available in NAIL SDK]",
    "base_score": null,
    "temporal_score": null,
    "agentic_score": null,
    "vector": null
  },
  "poc": null,
  "timeline": null,
  "_meta": {
    "schema_version": "1.0.0",
    "generated_at": "2026-03-24T19:26:21Z",
    "generator": "NAIL Institute AVE Toolkit",
    "license": "CC-BY-SA-4.0",
    "access_tier": "public",
    "redacted_fields": [
      "avss_score",
      "defences",
      "evidence",
      "mechanism",
      "poc",
      "timeline"
    ],
    "full_access": "https://github.com/NAIL-INSTITUTE-FOR-AGENTIC-SECURITY/ave-database"
  },
  "contributor": "dleigh"
}
