{
  "ave_id": "AVE-2025-0040",
  "name": "Authority Gradient Exploitation",
  "aliases": [
    "Hierarchy Hijacking",
    "Chain-of-Command Attack"
  ],
  "category": "delegation",
  "severity": "critical",
  "status": "proven",
  "summary": "Attackers impersonate higher-authority agents or system components to override safety constraints. Subordinate agents follow instructions from perceived superiors without verification.",
  "mechanism": "Malicious input claims to originate from a system administrator, orchestrator, or parent agent. The target agent's instruction-following training causes it to comply with authority-framed requests. [Available in NAIL SDK]",
  "blast_radius": "Complete safety bypass. Agent performs any action if framed as coming from authority.",
  "prerequisite": "Agent operating in a hierarchical multi-agent system or with role-based access.",
  "environment": {
    "frameworks": [
      "LangGraph"
    ],
    "models_tested": [
      "[Available in NAIL SDK]"
    ],
    "multi_agent": true,
    "tools_required": false,
    "memory_required": false
  },
  "evidence": [
    {
      "experiment_id": "[Available in NAIL SDK]",
      "key_metric": "[Available in NAIL SDK]",
      "key_value": "[Available in NAIL SDK]",
      "data_file": "",
      "p_value": null,
      "sample_size": null,
      "cross_model": false
    }
  ],
  "defences": [],
  "date_discovered": "2026-03",
  "date_published": "",
  "cwe_mapping": "",
  "mitre_mapping": "ATT&CK: T1068 | ATLAS-NOVEL: Authority Gradient Exploitation",
  "references": [],
  "related_aves": [
    "AVE-2025-0026",
    "AVE-2025-0027"
  ],
  "avss_score": {
    "overall_score": 9.4,
    "severity_label": "critical",
    "vector_string": "[Available in NAIL SDK]",
    "base_score": null,
    "temporal_score": null,
    "agentic_score": null,
    "vector": null
  },
  "poc": null,
  "timeline": null,
  "_meta": {
    "schema_version": "1.0.0",
    "generated_at": "2026-03-24T19:26:21Z",
    "generator": "NAIL Institute AVE Toolkit",
    "license": "CC-BY-SA-4.0",
    "access_tier": "public",
    "redacted_fields": [
      "avss_score",
      "defences",
      "evidence",
      "mechanism",
      "poc",
      "timeline"
    ],
    "full_access": "https://github.com/NAIL-INSTITUTE-FOR-AGENTIC-SECURITY/ave-database"
  },
  "contributor": "dleigh"
}
